{
  "schemaVersion": 1,
  "inputDigests": {
    "openapi": "sha256:d64629bacb657da3373788f90172264345d99cff4c136271b10d767b9489702c",
    "policy": "sha256:643b20eecb8705cf159cc1254242c9189d3ec7a1c1c4f4c83769bb99bbea72bc",
    "exceptions": null
  },
  "target": "aws",
  "summary": {
    "total": 0,
    "error": 0,
    "warning": 0,
    "info": 0,
    "suppressed": 0,
    "bySeverity": { "error": 0, "warning": 0, "info": 0 },
    "byConfidence": { "deterministic": 0, "high-confidence": 0, "heuristic": 0 },
    "byCategory": {
      "inventory": 0,
      "exposure": 0,
      "authentication": 0,
      "authorization": 0,
      "resource-limit": 0,
      "misconfiguration": 0,
      "governance": 0,
      "runtime-evidence": 0
    }
  },
  "findings": [],
  "suppressedFindings": [],
  "exceptionDiagnostics": [],
  "appliedExceptionIds": [],
  "analyzerCapabilities": {
    "openapi": {
      "routes": "complete",
      "parameters": "complete",
      "requestBodies": "complete",
      "authentication": "complete"
    },
    "policy": [
      { "id": "request.allow_methods", "status": "supported" },
      { "id": "request.allowed_hosts", "status": "supported" },
      { "id": "routes.request.allow_methods", "status": "unsupported" },
      { "id": "request.uri_query_limits", "status": "supported" },
      { "id": "request.header_limits", "status": "partial" },
      { "id": "request.content_type", "status": "unsupported" },
      { "id": "request.path_normalization", "status": "supported" },
      { "id": "auth.route_gates", "status": "partial" },
      { "id": "routes.response.cache_control", "status": "supported" },
      { "id": "response.security_headers", "status": "supported" },
      { "id": "response.csp_nonce", "status": "unsupported" },
      { "id": "request.graphql_guard", "status": "warning-only" },
      { "id": "response.response_dlp", "status": "warning-only" }
    ]
  },
  "analyzerDiagnostics": [],
  "omittedComparisons": [
    "policy.auth.route_gates:partial",
    "policy.request.content_type:unsupported",
    "policy.request.graphql_guard:warning-only",
    "policy.request.header_limits:partial",
    "policy.response.csp_nonce:unsupported",
    "policy.response.response_dlp:warning-only",
    "policy.routes.request.allow_methods:unsupported"
  ]
}
